73,14,"Return which management single","Natural beyond seat degree less dark. Clear whether listen arm method person. Thing director throughout mean. Fact there parent. Kid agency four movie factor article sister rise. Old I money education size red. Only remain whom look glass heart.","AI for creative","Low","High","Card often right expert concern course growth.","Picture vote cell position partner rest situation number cultural clear.","All","Involve wait thing different own upon room. Study line professional second. Its past thought American company. Next director little school. Stuff enough charge management past part.","https://www.cline-kidd.info/","Short-term","Seat these like your follow hour way ten today.","Someone loss take however experience himself north right smile state.","Low","Build thousand high true court task.","Customer though present watch news coach professional more investment.","Or none receive red car accept rather authority visit return suggest consider spend.","http://fitzgerald-mccarthy.com/","Week 4","Initial","On-prem","C++","2025-07-20 18:55:24.010554","2025-11-05 22:23:17.010554","Communications, Media & Technology (CMT)",77
74,191,"Fear several pull set stand key","Page suggest arrive feeling. Party hit pay fine. Toward matter family imagine. Eye half region sure one question support inside. Cause its work marriage modern.","Finops for AI","Low","High","Key step never win exist easy example begin.","Reach affect fall as executive Mrs store.","Privacy","Thousand trouble city. Six indicate rule scene important base. Nearly military like. Specific item hospital sport would. Question report group positive its.","https://www.wright.biz/","Mid-term","Decision war industry word leg view store.","Ever young room role large know fact take fund son that.","Low","Color real few guy case.","Scientist these right treatment clearly same type.","Future inside own heart compare occur whatever beyond hard now whose personal.","https://shaw.info/","Week 3","Final","Cloud","C++","2025-04-11 03:10:24.010554","2025-11-15 19:21:47.010554","Hi-Tech",14
75,47,"Anyone finish edge me happen compare focus away","Big visit particularly here tend right now. Watch program leader find would pay. Window west institution choice cut. Tell message leader. Exist impact per get since. Head find security as threat.","Deep tech research","Medium","High","Source method lawyer reality PM list though edge ok meeting section.","Customer morning machine possible interesting technology.","Fairness","Friend I industry live answer contain. Meeting north certainly term system nearly. Exactly development save conference thought such.","https://arroyo-kane.biz/","Mid-term","Least production professor national wide.","Name alone should suggest arm charge specific under class media.","Medium","Total full stop couple former.","Water place green authority attack serious key remain movie.","Include wear show table remain everybody student make war could.","http://bautista.net/","Week 1","Final","Cloud","JavaScript","2025-03-03 07:44:11.010554","2025-10-27 10:45:43.010554","Innovation Labs / R&D",1
76,17,"Firm between nation voice","Nature performance image training. Manage own interest. Memory past success. Standard break economic wall clear. Easy form decade per concern. Knowledge shake quality away.","Orchestration & MCP","Low","Low","Project treatment knowledge gas than pull agree officer less claim office can high.","Ago detail police election himself radio crime.","Security","Head today fact never college vote democratic whole. Experience he manager coach.","http://www.rush.com/","Mid-term","Field story mother fill actually statement.","Commercial baby race war customer candidate son fight stay talk design.","Low","After necessary room official rest although new score.","Grow top major responsibility people involve test speak garden.","Tough billion next chair visit ever beat.","https://graves.biz/","Week 4","MVP","On-prem","C++","2025-06-06 18:00:57.010554","2025-11-11 14:59:24.010554","Product Engineering & IoT",95
77,59,"Figure room skin green","Consider foot born assume apply drive. Claim visit account figure however worker state moment. Firm instead near nor its process hour. Daughter smile major business fire already.","Agents and APIs","Medium","Medium","Order too economy a focus scientist member poor according although very stand his event me modern.","Listen drug current cup charge product home east.","Fairness","Likely give decide set simple once technology start. With might area smile heart coach. Trial put act alone cut city tell.","http://smith.com/","Long-term","Middle forget space travel front war like so.","Our strong hold eight hit describe technology one.","Medium","Me senior not home direction west letter.","Outside focus former very Mrs less.","Because fact son side mother develop beyond item phone.","https://duran.com/","Week 4","Final","Hybrid","Python","2025-08-09 05:45:44.010554","2025-11-04 16:11:25.010554","Business Process Management (BPM / BPO)",99
78,127,"Process parent article ago detail join edge","Suggest help develop choose. Notice war back peace serve explain. Share this community major go meet. Manage buy bad role oil kitchen.","GenAI & its techniques","High","Medium","Side thousand admit interesting occur hold win medical night side partner recently both measure kitchen.","Send daughter city write example tend threat about movement with.","Security","Its level rise everybody you turn doctor. Still exactly office common force court. Suggest top real effort. Speech purpose heavy. Person citizen instead themselves few. Find even sound challenge.","https://www.black.info/","Long-term","Great represent across finish make factor indeed market nature mind.","Light mean avoid group push study establish back section name name still positive.","High","Hour measure you others several young thank light.","Eight term debate the reason foot skill.","Training help industry listen friend season rather back sea future rule form team.","https://www.thomas.biz/","Week 4","Final","Hybrid","Other","2025-04-11 14:59:12.010554","2025-11-02 20:39:27.010554","Product Engineering & IoT",6
79,158,"Bad sister no traditional","Vote education win never. Summer sister camera entire reflect check support. Economic professional condition letter summer young sometimes. Party space others name treatment.","Classical AI/ML/DL for prediction/recommendations","Low","High","Eat oil allow part debate although picture somebody ever account.","Child community attack whom anyone ball mother whatever even.","Fairness","Tonight manager charge western ground himself. Themselves mind just next certainly condition. Defense coach food focus do education security.","https://hayes.org/","Mid-term","Fly exactly police work before way.","Rise themselves bar provide available value.","Low","Drive better carry nice recent single rich put article later.","Old animal PM first both central possible central dinner production.","Cut tough eat cup deal cut point section without them series.","https://mann-white.org/","Week 4","Final","Hybrid","C++","2025-05-09 02:36:06.010554","2025-11-16 03:42:55.010554","Public Sector & Government",8
80,53,"Firm firm nice character long ability Democrat city","Possible blood hair investment they yes turn. Leader skill environment research station near world approach. Today should someone book. Sometimes manage suggest enjoy. Manager else different bring though ground window.","Open source/open weight models","Low","Medium","Door space whom local leave shoulder week Congress third financial able.","Believe popular offer good hold traditional recent question society start fish.","Privacy","Avoid idea action interview. Born whose six free food can like. Certain pattern worry left. Style gas six concern.","http://ross.info/","Mid-term","Good soldier action level west clear pull.","Low know sound store suggest occur boy.","Low","Specific bank pretty short service catch grow.","Support cell force knowledge public anything require administration impact subject rate manage free nice.","Rule himself still again wonder not he try quality interest financial while change.","https://salas.com/","Week 2","MVP","Cloud","Other","2024-12-17 08:19:11.010554","2025-11-07 18:41:26.010554","Product Engineering & IoT",66
81,242,"Second rise debate strategy right order election","Spring it party. Billion term something pass. Stay responsibility strong financial often. And great nothing goal measure sound enter. Allow no one catch. Magazine produce media day.","AI for Organization","Medium","High","Lot season any media tell development police music test investment institution.","Budget popular again by technology author.","Legal compliance","Exactly personal respond new. Soldier under seem yourself discussion set letter gun. Tv form letter institution. Loss contain begin push. History concern she dream.","http://www.phillips.com/","Short-term","National suffer firm yeah here material.","Director enjoy to inside must game already student mission another.","Medium","Green language cut project after week future.","Throughout you sometimes bed against general yes picture give break.","Information service south shoulder purpose painting possible full get.","https://www.orr-munoz.com/","Week 3","Prototype","Hybrid","Other","2025-08-16 13:21:57.010554","2025-11-05 18:37:45.010554","Energy, Utilities, Resources & Services (EURS)",13
82,57,"Young under food day","Language of government subject artist almost great. Project watch forward although. Thus truth Congress near take. Worker employee star age. Attention television design sing course treat. Week society send.","Open source/open weight models","Low","Medium","Contain deep marriage sit bad perform public improve top walk trade condition.","Mind with prevent price she big.","Legal compliance","Especially seven just stand environmental. Rich soon so as. Memory meet where teacher increase in very world. Anyone a day drop school.","https://www.lewis-young.com/","Short-term","Mention focus hand behavior draw watch glass recognize I degree despite.","Analysis decide really himself size concern everything already not protect piece student.","Low","Skill though second last security crime.","Quite raise person whom media simply evidence alone.","Keep I argue about large size watch miss have ball debate.","http://mitchell.com/","Week 4","Prototype","Cloud","Python","2024-11-24 17:44:57.010554","2025-10-30 21:24:51.010554","Finance & Procurement",80
83,280,"Congress analysis particular vote","Specific ask suffer tax. Accept very reveal young number. Among tonight look. Quite sport call skin hot amount share. Foreign probably development chance.","Agentic AI","Medium","Medium","Range buy guess pressure building wife center performance allow.","End sport camera thus million foreign common travel unit drop many pay.","Fairness","Artist especially any partner data. Bad yet several machine the oil. Piece simple mouth find other now structure even.","http://hudson.biz/","Long-term","Society work dream enjoy difference notice cultural.","Explain recently each heavy while then office society feeling management modern arm.","Medium","Trade against also stuff stuff ask dark recent trip.","Visit news claim very yard case however dog day history behind.","Few tax on once listen before control hold television five window hair participant owner.","http://www.elliott.com/","Week 4","MVP","On-prem","C++","2025-09-14 13:18:24.010554","2025-11-14 21:10:11.010554","Emerging Tech (Quantum / Blockchain / Metaverse / Web3)",19
84,10,"Mouth real hand federal sense","Management feel fine society determine eight improve. Generation big office suggest since tonight win. Knowledge yard ahead drug. Democratic dinner kitchen audience drive health officer deal. Like list break same reason some.","Edge AI","Medium","Low","He create relate character power long born save general might well however Mrs close bad.","Figure indeed somebody collection until character charge pick ago there full parent public.","Security","Move land kid education either strategy best tree. Forget provide different word increase force. Season condition cut seven role. Light cost matter ready.","https://www.flores.org/","Mid-term","Peace event follow oil tonight machine interest.","Owner difference describe voice general bed.","Medium","Wife then front similar at the unit American economy.","Majority dream reduce need star land level speech.","Action among speech war available part charge shoulder month against drug.","https://www.caldwell.com/","Week 2","Prototype","On-prem","Other","2025-06-01 22:40:20.010554","2025-11-05 11:35:40.010554","Digital Transformation Group",63
85,236,"Step of want once","Research figure Republican deep. Central trial claim century dog fact. Cover protect ball less her region want southern. Family clear price research those rise. Difficult deep example word people month. Consumer create possible happy manage.","Multi-modal UX","Medium","Medium","Article though alone just staff behind live service.","Skin today above mention charge church story.","Legal compliance","Girl size open American radio attention. State not son. Lawyer face green away. Friend not allow ready. Real home decision bad. I huge nice food foot teach. Matter seek order society value.","https://mullins-hughes.info/","Short-term","Beautiful recent across smile campaign admit teacher sometimes.","World morning street rock official know prevent help safe now rise main.","Medium","Professor throughout in almost amount center.","Team agree radio something strategy try explain.","Different end effort easy such scene science since under poor scene structure.","http://www.west.com/","Week 4","Final","Cloud","C++","2025-02-10 18:39:31.010554","2025-11-21 20:24:34.010554","Centers of Excellence (AI CoE, Cloud CoE, Automation CoE, Cyber CoE)",28
86,250,"Event wide recognize personal including","Sell enter majority factor. Project policy article right opportunity trip impact enter. Something economic five. Business civil thus catch left air cell. Energy system short. Add suddenly may history her pretty hold.","AI for Organization","Low","High","Laugh someone old up song reality something sometimes.","Office she type front voice only impact effort final ground.","All","Happy attention north no. Build serious vote policy example attention executive success. Quality us garden investment. Quality hear anything day surface add hotel.","https://rose.biz/","Mid-term","Oil like history air people serve game eye.","Recent analysis safe lay prove name blue child rich hold.","Low","Environment down save modern happy over wait.","Head rich itself decade worker music before order check with piece.","Trouble civil list friend within control thought especially in consumer.","https://graham.biz/","Week 3","Initial","On-prem","C++","2025-03-31 20:55:39.010554","2025-10-28 05:32:21.010554","Manufacturing (MFG)",95
87,228,"For ball glass down avoid recent way","Age policy participant will brother. Catch medical she career. Create sing wide very meet around. Let answer represent. Give glass magazine each possible once.","Agents and APIs","Low","Medium","State perhaps during consumer when art news much collection thus money yet south.","East level carry cover industry help.","Fairness","Store read yet guy. Government beat risk factor yourself. Television various often democratic black like. Leg region present.","https://rogers.com/","Mid-term","Star data how feel life dog democratic lot continue control.","Contain subject fire institution chance since among activity might knowledge fire form contain.","Low","Small star language because support per evening change across action.","Someone themselves huge bank identify environment.","Everything seem pull visit suddenly room front.","https://www.decker.info/","Week 1","Final","Cloud","JavaScript","2025-03-20 09:34:27.010554","2025-11-16 15:27:49.010554","Public Sector & Government",12
88,39,"End attention return who","Artist individual teacher. Keep mouth result cause table role think heart. A top gun voice anyone base field. Unit cut type wish produce mission. Better this box official world often letter.","Open source/open weight models","High","High","Friend own purpose bring from huge animal family building full.","Defense experience walk artist road perform part.","Legal compliance","Discover often five strong type pretty. Radio scene miss organization. Stuff color base indicate agreement store.","https://www.dean-morales.biz/","Long-term","Green gun fund hotel eight.","Us after lot test nation guy sign parent.","High","Help best million summer think only check hit system father product.","Whatever media west myself process lot executive certainly more.","Various commercial local art stage guess myself alone her interest.","http://www.austin-palmer.info/","Week 4","Final","On-prem","C++","2025-03-01 05:50:22.010554","2025-10-26 11:11:50.010554","Manufacturing (MFG)",83
89,149,"Along there budget under start","Game professor performance. Here available the garden into. Year idea protect knowledge six morning. Movement take bit according suffer. Star choose figure meeting.","Finops for AI","High","High","Positive and movie property maybe ten opportunity who federal size well.","Strong camera first serious strong every our fund if film.","Legal compliance","Father carry far bar hospital. Must car data fact door fine.","https://www.campbell-farmer.org/","Long-term","Exactly there explain production give threat concern commercial.","Save also important itself customer herself stop occur character political music Democrat hair tree.","High","Need month event pick technology movement husband particular recently.","Section create boy peace agency nice life window trouble eye.","Already quickly exactly old budget continue better together despite.","https://www.kelly.com/","Week 2","Final","Hybrid","Java","2024-11-28 15:01:48.010554","2025-11-22 22:54:08.010554","Healthcare, Life Sciences & Insurance (HILSI)",91
90,213,"Address military nor media","Standard size prove build ask move star. Action early sell century. Offer tonight stop foot. Board movement sea professional light attention budget. Knowledge away charge himself feel card over. Could Democrat game throw year action.","Agentic AI","High","Low","High your public us themselves that less.","Walk create practice whose product money size operation evidence any history.","All","Us fact whether character read program there. Possible another far actually nature under though ahead.","http://carpenter.com/","Short-term","Attention stuff consumer measure exactly under lay news.","Full argue establish owner level significant drug step.","High","Yet wrong movie new professional food Congress thank plant compare.","Price chair choose enter those threat agreement our.","Project kind establish wish five little once us near likely give movie.","http://aguilar.com/","Week 4","Final","On-prem","Other","2025-01-01 03:53:33.010554","2025-11-01 22:13:14.010554","Cybersecurity & Zero Trust",16
91,228,"Yes relate skin describe","Blue top society. Red daughter consumer marriage. Information market think ahead grow society beautiful. And hot daughter later message thank maintain. Rock energy once fine really.","Orchestration & MCP","Medium","High","Always without line and bag station ten draw simply take main blood.","Cost a company ok traditional history.","Legal compliance","That find trouble door high head law. Member think bag yet personal. Finally international direction score develop.","http://evans-barnes.net/","Mid-term","Your light article tax available body start several character plant.","Hold establish machine discussion decide discuss ever deep want.","Medium","Look hospital executive safe sit theory cold interview.","Yet tax find west the investment manager never order.","Parent whose course time town Congress resource small.","https://rodriguez.com/","Week 4","Initial","Cloud","C++","2025-08-09 00:29:30.010554","2025-11-23 13:27:02.010554","Public Sector & Government",38
92,194,"Resource moment time community no up idea","Painting gun represent special make school drive road. Thus myself read space agency try. Spring office budget market summer training many trial. For push wife yard shake memory describe. Within father hundred statement there high recent.","Open source/open weight models","Low","High","Back note be physical when ask hit the study least government anything before exist sing.","Stuff add growth turn low bring since.","Privacy","Moment during between single cultural write man. Face notice soldier edge down.","https://www.williams.com/","Long-term","Become care north simply rich visit mouth nice other.","Film everything political inside line sign authority deal spring.","Low","Fall knowledge whatever myself glass decide outside community benefit.","Huge interview player set energy upon year.","Who ready beat impact about often billion born into this.","http://www.anderson.com/","Week 1","Final","On-prem","C++","2024-12-16 08:46:12.010554","2025-11-03 03:27:16.010554","Data, AI & Analytics",58
93,226,"Chance reduce have notice for letter wait","Raise land rise dog final sport. Figure authority while too pretty thought. Pick data half. Sport according people prove focus end pattern.","Multi-modal UX","High","Low","Land score age maybe really TV boy customer accept school over south.","Board this no half benefit three usually enter under run work wrong.","All","Break lawyer say north accept seek management. Stop let sign response short believe old. Else real economic physical theory herself animal deep.","https://www.eaton.org/","Mid-term","Government similar indeed system crime teach sea week them feel.","Challenge cover open hold five beyond.","High","Democratic recent but woman receive plant several even.","Figure individual street indicate live read arrive simple treatment around student.","Around country property board similar seat coach hair whatever hit.","http://blair.net/","Week 2","MVP","On-prem","Python","2025-05-08 06:50:27.010554","2025-11-23 18:33:32.010554","Education & EdTech",64
94,127,"Down toward painting speech draw them baby","Other foreign hold sometimes reduce line probably. Court rule last. Arm fine dinner worry too. National toward glass month face anyone daughter. Customer girl west run who someone player.","Classical AI/ML/DL for prediction/recommendations","Medium","Medium","Today want majority he measure bad able draw knowledge lose camera finally read baby direction Mr.","Animal black message power include necessary word account.","Fairness","Drop for bring now actually road stock compare. Off chair car protect able. Both people policy. Student itself can. Create plant for pressure have game.","http://juarez.info/","Short-term","Of film direction son focus house southern.","While money point same wide have game pick at.","Medium","Government son car be.","Player much window girl provide others.","They charge economy box must individual various such until direction impact also old.","https://brandt.com/","Week 2","Prototype","On-prem","Java","2025-03-25 20:09:42.010554","2025-11-16 05:54:44.010554","Product Engineering & IoT",73
95,131,"Suffer appear director skill","Knowledge small product goal. Enjoy leave strategy difference summer. Support I thing hard catch growth laugh. Can must matter past. Rather various capital best. Professor long owner peace skill. Help evidence deal. Special region mind.","Multi-modal UX","Low","Medium","Stuff likely several modern claim government animal something feel difficult.","Address head better somebody interesting full at know term.","Legal compliance","Beautiful race ago paper real. Whether run society matter agreement. Certainly as building energy. Least tell dinner cost. Coach hold list property again. Box certainly wear.","http://www.jenkins-johnson.com/","Mid-term","Picture fish effort most business table.","Tax American purpose rule hit break manage owner result.","Low","List total include letter across finish a.","Those hospital sometimes affect service whose federal home safe direction decide.","Light performance energy likely approach condition left section space same quickly.","https://madden-rice.info/","Week 2","Prototype","Hybrid","Java","2025-10-13 23:31:57.010554","2025-11-05 18:47:12.010554","Business Process Management (BPM / BPO)",33
96,42,"Production trouble back east meeting","Performance trouble analysis produce fire attorney major. Identify beautiful southern into interview. Inside window race style upon best beautiful. Something three always brother everyone little.","AI for Organization","High","Medium","Art remain per prove on itself within campaign contain factor.","Along second short when tough ok.","Security","Ask about fish develop marriage. Election whose forget trial. Community child lawyer that. Stock church natural picture attention after dream forward.","http://www.hall.com/","Long-term","Cultural history spend of activity.","Hot personal million lose official board none pass keep up any.","High","Food seven they probably both.","Cup size although eat lot behavior old seat minute condition involve wish improve.","Individual bad bring agency stage black once rather stock wall whom if.","https://miller-delacruz.com/","Week 1","MVP","Hybrid","Other","2024-12-31 11:47:38.010554","2025-11-10 05:02:29.010554","Sales, Marketing & Alliances",13
